{
  "record_type": "manual_ranking_seed_batch",
  "schema_version": "v1",
  "batch_id": "test-manual-seed-batch",
  "created_at": "2026-07-10T00:00:00Z",
  "records": [
    {
      "ranking_system": "u_s_news",
      "ranking_family": "national_universities",
      "category_id": "national-universities",
      "edition": "2026 Best Colleges",
      "school_display_name": "Test University",
      "numeric_rank": 10,
      "displayed_rank": "10",
      "tied": false,
      "source": {"source_id": "test-source-best-colleges", "url": "https://example.invalid/test", "accessed_at": "2026-07-10T00:00:00Z"},
      "entered_by": "test-runner",
      "entered_at": "2026-07-10T00:00:00Z",
      "verification_status": "verified",
      "notes": "Test fixture only"
    }
  ]
}
